{
  "$schema": "../../.mlgs/task-context.schema.json",
  "schemaVersion": "1.0",
  "id": "replace-me",
  "workPackageId": "replace-me",
  "projectKind": "new-project",
  "intensity": "lightweight",
  "requirementSources": [],
  "scopeIds": [],
  "targetModuleId": "",
  "codeFilesRead": [],
  "symbols": [],
  "exemplars": [],
  "integrationPoints": [],
  "dependencies": [],
  "plannedFiles": { "modify": [], "create": [], "delete": [], "evidence": [] },
  "unitySurfaces": { "scenes": [], "prefabs": [], "configuration": [], "ui": [], "tests": [] },
  "structuralEvidence": { "provider": "none", "queries": [], "evidence": [], "preImpactVerdict": "not-required", "postImpactVerdict": "not-required", "notes": "" },
  "freshness": { "codebaseProfileSha256": "", "moduleMapSha256": "" },
  "architectVerdict": "pending",
  "status": "draft",
  "blockers": [],
  "updated": ""
}
